[
  {
    "query_id": "Q-ENERGY-001",
    "query_template": "How much energy is consumed by the nodes, racks, and machine over a given period of time?",
    "category": "Power, Energy & Sustainability",
    "difficulty": "medium",
    "tags": [
      "energy",
      "aggregation",
      "timeseries"
    ],
    "roles_covered": [
      "System Administrator"
    ],
    "variants": [
      {
        "user_type": "System Administrator",
        "intent": "Aggregate IT energy over time by scope",
        "data_sources": [
          "IPMI",
          "Prometheus",
          "PowerMeters"
        ],
        "query_text": "How much energy is consumed by the nodes, racks, and machine over a given period of time?",
        "expected_answer": "chart",
        "difficulty": "medium",
        "priority": "high",
        "evaluation_signal": "range_check",
        "dependencies": [
          "rack_node_mapping"
        ],
        "dedupe_of": null,
        "notes": ""
      }
    ],
    "created_at": "2025-11-01T00:00:00Z",
    "notes": ""
  },
  {
    "query_id": "Q-ENERGY-002",
    "query_template": "How much energy is consumed by the cooling system (air and water) over a given period of time?",
    "category": "Facility, Infrastructure & Environmental Systems",
    "difficulty": "medium",
    "tags": [
      "cooling",
      "energy",
      "facility"
    ],
    "roles_covered": [
      "Facility Admin / Technicians"
    ],
    "variants": [
      {
        "user_type": "Facility Admin / Technicians",
        "intent": "Measure facility-side cooling energy over time",
        "data_sources": [
          "BMS",
          "DCIM",
          "PowerMeters"
        ],
        "query_text": "How much energy is consumed by the cooling system (air and water) over a given period of time?",
        "expected_answer": "chart",
        "difficulty": "medium",
        "priority": "high",
        "evaluation_signal": "range_check",
        "dependencies": [],
        "dedupe_of": null,
        "notes": ""
      }
    ],
    "created_at": "2025-11-01T00:00:00Z",
    "notes": ""
  },
  {
    "query_id": "Q-ENERGY-003",
    "query_template": "What is the PUE (Power Usage Effectiveness) of a machine or compute room over a given period of time?",
    "category": "Power, Energy & Sustainability",
    "difficulty": "hard",
    "tags": [
      "PUE",
      "sustainability",
      "ratio"
    ],
    "roles_covered": [
      "Facility Admin / Technicians"
    ],
    "variants": [
      {
        "user_type": "Facility Admin / Technicians",
        "intent": "Compute PUE for a machine or room over time",
        "data_sources": [
          "BMS",
          "IPMI",
          "PowerMeters"
        ],
        "query_text": "What is the PUE (Power Usage Effectiveness) of a machine or compute room over a given period of time?",
        "expected_answer": "chart",
        "difficulty": "hard",
        "priority": "high",
        "evaluation_signal": "heuristic_scoring",
        "dependencies": [],
        "dedupe_of": null,
        "notes": ""
      }
    ],
    "created_at": "2025-11-01T00:00:00Z",
    "notes": ""
  },
  {
    "query_id": "Q-JOB-004",
    "query_template": "How many jobs are running on a particular node over a given period of time?",
    "category": "Job & Workflow Management",
    "difficulty": "easy",
    "tags": [
      "jobs",
      "node"
    ],
    "roles_covered": [
      "System Administrator"
    ],
    "variants": [
      {
        "user_type": "System Administrator",
        "intent": "Count concurrent jobs on a node over time",
        "data_sources": [
          "SLURM"
        ],
        "query_text": "How many jobs are running on a particular node over a given period of time?",
        "expected_answer": "chart",
        "difficulty": "easy",
        "priority": "medium",
        "evaluation_signal": "exact_match",
        "dependencies": [],
        "dedupe_of": null,
        "notes": ""
      }
    ],
    "created_at": "2025-11-01T00:00:00Z",
    "notes": ""
  },
  {
    "query_id": "Q-RELIAB-005",
    "query_template": "Provide the distribution over time of the usage of resources (CPUs, GPUs, Memory) before a node fails, over a given period of time.",
    "category": "Monitoring & Observability",
    "difficulty": "hard",
    "tags": [
      "failure",
      "distribution",
      "profiling"
    ],
    "roles_covered": [
      "HPC Researcher"
    ],
    "variants": [
      {
        "user_type": "HPC Researcher",
        "intent": "Characterize resource usage prior to node failure",
        "data_sources": [
          "Prometheus",
          "SLURM",
          "Logs"
        ],
        "query_text": "Provide the distribution over time of the usage of resources (CPUs, GPUs, Memory) before a node fails, over a given period of time.",
        "expected_answer": "chart",
        "difficulty": "hard",
        "priority": "medium",
        "evaluation_signal": "heuristic_scoring",
        "dependencies": [
          "failure_events_database"
        ],
        "dedupe_of": null,
        "notes": ""
      }
    ],
    "created_at": "2025-11-01T00:00:00Z",
    "notes": ""
  },
  {
    "query_id": "Q-ENERGY-006",
    "query_template": "Give me the node’s resource utilization distribution when the PUE is higher than a given value.",
    "category": "Power, Energy & Sustainability",
    "difficulty": "hard",
    "tags": [
      "PUE",
      "utilization",
      "conditional"
    ],
    "roles_covered": [
      "HPC Researcher"
    ],
    "variants": [
      {
        "user_type": "HPC Researcher",
        "intent": "Relate node utilization to high PUE conditions",
        "data_sources": [
          "Prometheus",
          "BMS",
          "IPMI",
          "PowerMeters"
        ],
        "query_text": "Give me the node’s resource utilization distribution when the PUE is higher than a given value.",
        "expected_answer": "chart",
        "difficulty": "hard",
        "priority": "medium",
        "evaluation_signal": "heuristic_scoring",
        "dependencies": [],
        "dedupe_of": null,
        "notes": ""
      }
    ],
    "created_at": "2025-11-01T00:00:00Z",
    "notes": ""
  },
  {
    "query_id": "Q-ENERGY-007",
    "query_template": "Give me the node’s resource utilization distribution for a specific JobID whose job PUE is higher than a given value.",
    "category": "Power, Energy & Sustainability",
    "difficulty": "hard",
    "tags": [
      "job",
      "PUE",
      "utilization"
    ],
    "roles_covered": [
      "HPC Researcher"
    ],
    "variants": [
      {
        "user_type": "HPC Researcher",
        "intent": "Relate utilization to high job PUE for a specific job",
        "data_sources": [
          "SLURM",
          "Prometheus",
          "IPMI",
          "PowerMeters"
        ],
        "query_text": "Give me the node’s resource utilization distribution for a specific JobID whose job PUE is higher than a given value.",
        "expected_answer": "chart",
        "difficulty": "hard",
        "priority": "medium",
        "evaluation_signal": "heuristic_scoring",
        "dependencies": [],
        "dedupe_of": null,
        "notes": ""
      }
    ],
    "created_at": "2025-11-01T00:00:00Z",
    "notes": ""
  },
  {
    "query_id": "Q-ENERGY-008",
    "query_template": "Give me the node’s resource utilization distribution for a specific JobID whose job power is higher than a given value.",
    "category": "Power, Energy & Sustainability",
    "difficulty": "medium",
    "tags": [
      "job",
      "power",
      "distribution"
    ],
    "roles_covered": [
      "HPC Researcher"
    ],
    "variants": [
      {
        "user_type": "HPC Researcher",
        "intent": "Summarize utilization for all jobs exceeding a power threshold",
        "data_sources": [
          "SLURM",
          "Prometheus",
          "IPMI"
        ],
        "query_text": "Give me the node’s resource utilization distribution for a specific JobID whose job power is higher than a given value.",
        "expected_answer": "chart",
        "difficulty": "medium",
        "priority": "medium",
        "evaluation_signal": "heuristic_scoring",
        "dependencies": [],
        "dedupe_of": null,
        "notes": ""
      }
    ],
    "created_at": "2025-11-01T00:00:00Z",
    "notes": ""
  },
  {
    "query_id": "Q-ENERGY-009",
    "query_template": "Provide the node’s resource utilization (or users) distribution for all jobs whose node’s average job power is higher than a given value.",
    "category": "Power, Energy & Sustainability",
    "difficulty": "medium",
    "tags": [
      "aggregation",
      "power",
      "jobs"
    ],
    "roles_covered": [
      "HPC Researcher"
    ],
    "variants": [
      {
        "user_type": "HPC Researcher",
        "intent": "Aggregate utilization for jobs exceeding average node power thresholds",
        "data_sources": [
          "SLURM",
          "Prometheus",
          "IPMI"
        ],
        "query_text": "Provide the node’s resource utilization (or users) distribution for all jobs whose node’s average job power is higher than a given value.",
        "expected_answer": "chart",
        "difficulty": "medium",
        "priority": "medium",
        "evaluation_signal": "heuristic_scoring",
        "dependencies": [],
        "dedupe_of": null,
        "notes": ""
      }
    ],
    "created_at": "2025-11-01T00:00:00Z",
    "notes": ""
  },
  {
    "query_id": "Q-THERM-010",
    "query_template": "What are the min, max, and average temperatures when a node is in use, over a given period of time?",
    "category": "Monitoring & Observability",
    "difficulty": "easy",
    "tags": [
      "temperature",
      "summary"
    ],
    "roles_covered": [
      "System Administrator"
    ],
    "variants": [
      {
        "user_type": "System Administrator",
        "intent": "Summarize temperatures while node is in use",
        "data_sources": [
          "IPMI",